{
  "kind": "ReLaneSpecialistCommandPackGateV1",
  "schemaVersion": 1,
  "generatedAt": "2026-06-12T00:00:00.000Z",
  "ReLaneSpecialistCommandPackGateV1": true,
  "runtime": "runtime:re_lane-specialist-command-pack",
  "requiredGates": [
    "relane_specialist_command_pack_gate",
    "route_to_domain_lane_seed_matrix",
    "domain_lane_command_pack_markers",
    "specialist_evidence_analyzer_anchor_matrix",
    "self_heal_command_fallback_matrix",
    "proof_exit_bridge_matrix",
    "runtime_re_lane_specialist_pack_tool",
    "completion_audit_domain_proof_exit_bridge"
  ],
  "domainCount": 15,
  "readyDomainCount": 15,
  "rows": [
    {
      "domainId": "web-api",
      "routeMatchers": [
        "Web / API security",
        "auth/session",
        "IDOR/BOLA",
        "XHR/WS"
      ],
      "laneSeeds": [
        "surface",
        "state",
        "authz",
        "replay"
      ],
      "commandPackMarkers": [
        "re_live_browser run",
        "re_web_authz_state run",
        "curl -i",
        "route-auth-map"
      ],
      "analyzerAnchors": [
        "browser/XHR/WS runtime anchors",
        "browser route graph anchors",
        "browser auth matrix anchors",
        "browser authz object ownership anchors"
      ],
      "selfHealCommands": [
        "re_lane plan state <target>",
        "re_web_authz_state plan <target>",
        "re_operator plan"
      ],
      "proofExitBridge": [
        "principal matrix",
        "object ownership",
        "state rollback",
        "signed replay divergence"
      ],
      "status": "ready",
      "gaps": []
    },
    {
      "domainId": "web-scan",
      "routeMatchers": [
        "Web vulnerability scanning",
        "nuclei",
        "ffuf",
        "content discovery"
      ],
      "laneSeeds": [
        "scope",
        "crawl",
        "template",
        "verify"
      ],
      "commandPackMarkers": [
        "web scanner scope",
        "web scanner crawl",
        "web scanner template",
        "web scanner manual replay"
      ],
      "analyzerAnchors": [
        "web scanner scope anchors",
        "web scanner crawl corpus anchors",
        "web scanner finding queue anchors",
        "manual replay verifier anchors"
      ],
      "selfHealCommands": [
        "re_lane plan scope <target>",
        "re_replayer run",
        "re_verifier matrix"
      ],
      "proofExitBridge": [
        "scope baseline",
        "crawl corpus",
        "scanner finding queue",
        "manual replay verifier"
      ],
      "status": "ready",
      "gaps": []
    },
    {
      "domainId": "frontend-js",
      "routeMatchers": [
        "Frontend JS reverse",
        "crypto.subtle",
        "sign",
        "WebSocket"
      ],
      "laneSeeds": [
        "observe",
        "rebuild",
        "divergence",
        "replay"
      ],
      "commandPackMarkers": [
        "js-network-surface",
        "source-map-search",
        "js signing rebuild",
        "js first-divergence"
      ],
      "analyzerAnchors": [
        "JS signing rebuild anchors",
        "crypto.subtle operation anchors",
        "JS signing normalized artifact anchors",
        "JS first-divergence anchors"
      ],
      "selfHealCommands": [
        "re_lane plan rebuild <target>",
        "re_live_browser run <target>",
        "re_replayer run"
      ],
      "proofExitBridge": [
        "observed normalizer",
        "first divergence",
        "signed replay harness"
      ],
      "status": "ready",
      "gaps": []
    },
    {
      "domainId": "rev-native",
      "routeMatchers": [
        "Native reverse",
        "ELF",
        "Mach-O",
        "headers/imports"
      ],
      "laneSeeds": [
        "triage",
        "control",
        "runtime",
        "patch"
      ],
      "commandPackMarkers": [
        "headers-imports",
        "strings-interesting",
        "r2-xrefs",
        "objdump-control"
      ],
      "analyzerAnchors": [
        "Native deep symbol/import/string anchors",
        "Native decompiler/control-flow anchors",
        "Native compare trace anchors",
        "Native patch hypothesis anchors"
      ],
      "selfHealCommands": [
        "re_native_runtime plan <target>",
        "re_lane plan control <target>",
        "re_verifier matrix"
      ],
      "proofExitBridge": [
        "symbol/import map",
        "comparison sink",
        "runtime trace",
        "patch/replay proof"
      ],
      "status": "ready",
      "gaps": []
    },
    {
      "domainId": "pwn",
      "routeMatchers": [
        "Pwn / exploit",
        "mitigations",
        "crash",
        "ROP/libc"
      ],
      "laneSeeds": [
        "triage",
        "primitive",
        "leak",
        "verify"
      ],
      "commandPackMarkers": [
        "pwn-mitigations",
        "crash-seed",
        "cyclic",
        "ROP/libc"
      ],
      "analyzerAnchors": [
        "pwn primitive crash/control anchors",
        "pwn cyclic offset anchors",
        "pwn gadget anchors",
        "pwn ROP/libc chain anchors"
      ],
      "selfHealCommands": [
        "re_native_runtime run <target>",
        "re_exploit_lab run <target> 3",
        "re_proof_loop run <target> 4 2"
      ],
      "proofExitBridge": [
        "offset",
        "leak source",
        "controllable bytes",
        "local verifier"
      ],
      "status": "ready",
      "gaps": []
    },
    {
      "domainId": "mobile",
      "routeMatchers": [
        "Mobile / Android",
        "APK",
        "Frida",
        "jadx"
      ],
      "laneSeeds": [
        "manifest",
        "control",
        "runtime",
        "hook"
      ],
      "commandPackMarkers": [
        "apk-manifest",
        "jadx-keyword-map",
        "frida-hook-scaffold",
        "native-lib-map"
      ],
      "analyzerAnchors": [
        "mobile APK manifest anchors",
        "Frida/GDB trace anchors",
        "Java crypto hooks",
        "native compare hooks"
      ],
      "selfHealCommands": [
        "re_mobile_runtime plan <target>",
        "re_lane plan control <target>",
        "re_verifier matrix"
      ],
      "proofExitBridge": [
        "manifest/package map",
        "Java/native hook",
        "anti-debug evidence",
        "runtime anchors"
      ],
      "status": "ready",
      "gaps": []
    },
    {
      "domainId": "mobile-ios",
      "routeMatchers": [
        "Mobile / iOS",
        "iOS IPA",
        "Info.plist",
        "Keychain"
      ],
      "laneSeeds": [
        "ipa-inventory",
        "macho",
        "hook",
        "network"
      ],
      "commandPackMarkers": [
        "ios-ipa-inventory-scaffold",
        "ios-macho-class-map",
        "ios-frida-hook-template",
        "ios-network-keychain-replay"
      ],
      "analyzerAnchors": [
        "iOS IPA anchors",
        "Mach-O/class map anchors",
        "iOS Frida/objection hook anchors",
        "keychain/network replay anchors"
      ],
      "selfHealCommands": [
        "re_lane plan ipa-inventory <target>",
        "re_mobile_runtime run <target>",
        "re_replayer run"
      ],
      "proofExitBridge": [
        "IPA inventory",
        "Mach-O/class map",
        "Frida/objection hook",
        "network/keychain replay"
      ],
      "status": "ready",
      "gaps": []
    },
    {
      "domainId": "pcap-dfir",
      "routeMatchers": [
        "DFIR / PCAP / stego",
        "tcp.stream",
        "flow conversation",
        "carved object"
      ],
      "laneSeeds": [
        "flow",
        "stream",
        "extract",
        "timeline"
      ],
      "commandPackMarkers": [
        "pcap-flow",
        "pcap-stream",
        "pcap-extract",
        "pcap-secret"
      ],
      "analyzerAnchors": [
        "PCAP/DFIR traffic flow anchors",
        "PCAP stream ranking anchors",
        "PCAP extracted artifact anchors",
        "PCAP secret timeline anchors"
      ],
      "selfHealCommands": [
        "re_lane plan extract <target>",
        "re_knowledge_graph build",
        "re_verifier matrix"
      ],
      "proofExitBridge": [
        "flow conversation",
        "follow-stream",
        "carved object",
        "timeline evidence"
      ],
      "status": "ready",
      "gaps": []
    },
    {
      "domainId": "memory-forensics",
      "routeMatchers": [
        "Memory forensics",
        "volatility",
        "vmem",
        "process/network"
      ],
      "laneSeeds": [
        "image",
        "process-network",
        "credential",
        "timeline"
      ],
      "commandPackMarkers": [
        "memory-image-profile-scaffold",
        "memory-process-network-scaffold",
        "memory-credential-artifact-scaffold",
        "memory-timeline-carve-scaffold"
      ],
      "analyzerAnchors": [
        "memory forensics image anchors",
        "memory forensics process/network anchors",
        "memory forensics credential/artifact anchors",
        "memory forensics timeline/carve anchors"
      ],
      "selfHealCommands": [
        "re_lane plan process-network <target>",
        "re_replayer run",
        "re_verifier matrix"
      ],
      "proofExitBridge": [
        "image profile",
        "process/network map",
        "credential/artifact proof",
        "timeline/carve evidence"
      ],
      "status": "ready",
      "gaps": []
    },
    {
      "domainId": "firmware-iot",
      "routeMatchers": [
        "Firmware / IoT",
        "rootfs",
        "squashfs",
        "emulation"
      ],
      "laneSeeds": [
        "extract",
        "service",
        "config",
        "emulate"
      ],
      "commandPackMarkers": [
        "firmware-image-fingerprint",
        "firmware-extraction-rootfs",
        "firmware-service-surface",
        "firmware-config-secret"
      ],
      "analyzerAnchors": [
        "Firmware image metadata anchors",
        "Firmware extraction/rootfs anchors",
        "Firmware config/secret anchors",
        "Firmware emulation/runtime anchors"
      ],